{
  "project": "_test",
  "display_name": "Test projektu",
  "version": "0.1.0",
  "updated": "2026-02-19",
  "description": "Minim√°ln√≠ testovac√≠ dokument pro ovƒõ≈ôen√≠ build pipeline.",
  "status": "wip",
  "port": 9999,
  "tech": ["python", "jinja2"],
  "access": {
    "local": "http://localhost:9999",
    "lan": "http://192.168.0.101:9999"
  },
  "modules": [
    {
      "id": "main",
      "name": "main.py",
      "file": "main.py",
      "purpose": "Vstupn√≠ bod aplikace.",
      "status": "stable",
      "public_methods": [
        {
          "name": "run",
          "params": "host: str = '0.0.0.0', port: int = 9999",
          "returns": "None",
          "description": "Spust√≠ server."
        }
      ],
      "dependencies": [],
      "notes": "Testovac√≠ modul."
    }
  ],
  "sections": [
    {
      "id": "prehled",
      "title": "P≈ôehled",
      "icon": "üìã",
      "blocks": [
        {"type": "text", "text": "Toto je testovac√≠ sekce pro ovƒõ≈ôen√≠ v≈°ech typ≈Ø blok≈Ø."},
        {"type": "heading", "text": "Typy blok≈Ø"},
        {"type": "list", "ordered": false, "entries": ["text ‚Äî odstavec", "code ‚Äî k√≥dov√Ω blok", "table ‚Äî tabulka", "card ‚Äî karta", "list ‚Äî seznam"]},
        {"type": "list", "ordered": true, "entries": ["Krok prvn√≠", "Krok druh√Ω", "Krok t≈ôet√≠"]},
        {"type": "code", "lang": "bash", "text": "python build.py --project _test\npython build.py --check\npython build.py --force"},
        {"type": "table",
          "headers": ["Typ", "Popis"],
          "rows": [
            ["<code>text</code>", "Prost√Ω odstavec textu"],
            ["<code>code</code>", "K√≥dov√Ω blok s escapingem HTML"],
            ["<code>card</code>", "Informaƒçn√≠ karta s variantou"]
          ]
        },
        {"type": "card", "variant": "info", "title": "‚ÑπÔ∏è Info karta", "text": "Testovac√≠ info karta.", "entries": ["polo≈æka 1", "polo≈æka 2"]},
        {"type": "card", "variant": "warning", "title": "‚ö†Ô∏è Varov√°n√≠", "text": "Toto je varov√°n√≠.", "code": "sudo rm -rf /proc/test  # jen test, obsah s < a > znaky"},
        {"type": "card", "variant": "danger", "title": "‚ùå Nebezpeƒç√≠", "text": "Nevratn√° operace bez entries."},
        {"type": "card", "variant": "success", "title": "‚úÖ √öspƒõch", "text": "V≈°e v po≈ô√°dku."}
      ]
    }
  ]
}
